{"contract_version":"0.1","assessment_id":"ceuta-2026-probability-contract-fixture","case_snapshot_sha256":"9d6e1e3c3c19fc5fbe56ca65f89e836b694c99587e0852d6fded758330ae430c","domain_id":"state-migration-coercion","safety":{"automatic_attribution_enabled":false,"public_conclusion_authorised":false,"calculation_mode":"validator_only"},"sufficiency_gate":{"required_statuses":["mature","resolved"],"actual_status":"insufficient","passed":false,"probability_updates_allowed":false,"reason":"The controlled fixture deliberately lacks enough independent operational evidence."},"hypotheses":[{"id":"h-organic","label":"Predominantly organic mobilisation","prior":{"minimum":0.2,"maximum":0.5,"point_estimate":0.35,"provenance":["Domain comparison library includes non-coercive and organic multi-causal movements.","Case-specific public evidence has not passed the sufficiency gate."],"assumptions":["The primary-cause group is an analytical simplification.","The mixed hypothesis is assessed separately and is not included in the exclusive sum."],"uncertainty_reason":"Public evidence does not yet establish the mobilisation origin or border command chain."},"evidence_confidence":{"level":"low","reason":"The fixture has limited independent streams and no authenticated operational record.","change_conditions":["Independent mobilisation-origin records are authenticated.","Operational enforcement records become inspectable."]}},{"id":"h-domestic","label":"Deliberate domestic-state exploitation","prior":{"minimum":0.2,"maximum":0.55,"point_estimate":0.35,"provenance":["The domain library contains institutionally attributed and parliamentary-attributed comparison cases.","Historical similarity is not treated as a measured frequency."],"assumptions":["Domestic permission and foreign command are distinct hypotheses.","Motive is not counted as conduct evidence."],"uncertainty_reason":"Changed enforcement could reflect intent, ordinary failure or mixed causation."},"evidence_confidence":{"level":"low","reason":"The fixture contains no authenticated instruction or verified command evidence.","change_conditions":["Authenticated non-intervention orders are recovered.","Independent deployment records establish retained capability and selective enforcement."]}},{"id":"h-foreign-direct","label":"Direct foreign operational direction","prior":{"minimum":0.0,"maximum":0.15,"point_estimate":0.05,"provenance":["Direct command requires stronger bridge evidence than motive, hostility or aligned messaging.","No authenticated third-state operational communication is present."],"assumptions":["Foreign encouragement is not equivalent to direct command.","Routine diplomatic contact is not operational evidence."],"uncertainty_reason":"The decisive communications and financial evidence are absent or inaccessible."},"evidence_confidence":{"level":"very_low","reason":"No event-specific operational link is authenticated.","change_conditions":["Authenticated communications discuss the event-specific operational action.","Financial or logistical records connect the foreign actor to implementation."]}},{"id":"h-insufficient","label":"Insufficient information for primary attribution","prior":{"minimum":0.15,"maximum":0.45,"point_estimate":0.25,"provenance":["The research-sufficiency profile currently returns insufficient.","Critical command and mobilisation evidence remains missing or inaccessible."],"assumptions":["Insufficient information is treated as an explicit analytical outcome.","It may coexist with uncertainty about all substantive mechanisms."],"uncertainty_reason":"The public evidence base cannot yet separate the leading explanations reliably."},"evidence_confidence":{"level":"high","reason":"The absence of sufficient research coverage is directly inspectable in the fixture.","change_conditions":["All critical requirements pass the declared sufficiency profile.","Sensitivity to disputed evidence falls below the agreed threshold."]}},{"id":"h-mixed","label":"Organic movement later deliberately exploited","prior":{"minimum":0.2,"maximum":0.65,"point_estimate":0.4,"provenance":["The domain method requires mixed-cause analysis where organic and deliberate mechanisms can coexist.","The point estimate is not part of the primary-cause exclusive sum."],"assumptions":["Organic mobilisation and deliberate exploitation can occur sequentially.","The hypothesis overlaps both organic and domestic-deliberate mechanisms."],"uncertainty_reason":"The sequence between mobilisation and enforcement change is unresolved."},"evidence_confidence":{"level":"low","reason":"The fixture does not establish the event sequence with independent timestamped evidence.","change_conditions":["Mobilisation records establish an organic start before state behaviour changed.","Operational records establish a later deliberate enforcement decision."]}}],"nonexclusive_relationships":[{"from":"h-mixed","to":"h-organic","type":"nested_under"},{"from":"h-mixed","to":"h-domestic","type":"nested_under"}],"exclusive_groups":[{"id":"primary-attribution-state","scope":"Current primary explanation or explicit inability to attribute; mixed causation is reported separately.","hypothesis_ids":["h-organic","h-domestic","h-foreign-direct","h-insufficient"],"point_estimates":{"h-organic":0.35,"h-domestic":0.35,"h-foreign-direct":0.05,"h-insufficient":0.25}}],"likelihood_scale":[{"id":"negligible","minimum_multiplier":0.8,"maximum_multiplier":1.25,"interpretation":"The evidence is similarly expected under the competing hypotheses.","assignment_rule":"Use when the evidence fits several explanations and has little diagnostic value."},{"id":"weak","minimum_multiplier":1.25,"maximum_multiplier":2.0,"interpretation":"The evidence modestly favours one hypothesis.","assignment_rule":"Require a stated alternative explanation and dependency review."},{"id":"moderate","minimum_multiplier":2.0,"maximum_multiplier":5.0,"interpretation":"The evidence meaningfully distinguishes hypotheses.","assignment_rule":"Require inspectable evidence, source authority and an explicit likelihood rationale."},{"id":"strong","minimum_multiplier":5.0,"maximum_multiplier":20.0,"interpretation":"The evidence would be substantially more expected under one hypothesis.","assignment_rule":"Require independent review and sensitivity testing."},{"id":"very_strong","minimum_multiplier":20.0,"maximum_multiplier":100.0,"interpretation":"Competing explanations have difficulty accounting for the evidence.","assignment_rule":"Reserve for authenticated, highly diagnostic evidence with correlation controlled."}],"dependency_policy":{"independence_group_required":true,"correlation_discount_required":true,"double_counting_prohibited":true,"manual_override_requires_reason":true,"maximum_full_weight_per_independence_group":1,"correlation_method":"Count one full-weight evidence contribution per independence group; document and discount derivative contributions."},"sensitivity_plan":{"required":true,"tests":[{"id":"prior-range-extremes","variable":"Each hypothesis prior within its declared minimum and maximum.","low_assumption":"Use all declared lower bounds where coherent.","high_assumption":"Use all declared upper bounds where coherent.","reported_output":"Range of posterior ordering and any change in leading hypothesis."},{"id":"remove-strongest-evidence","variable":"Strongest single evidence stream.","low_assumption":"Remove the stream entirely.","high_assumption":"Retain its maximum permitted weight.","reported_output":"Whether the conclusion depends on one evidence origin."},{"id":"correlation-discount","variable":"Dependence between repeated or related reports.","low_assumption":"Treat derivative reports as zero additional weight.","high_assumption":"Apply the maximum documented partial contribution.","reported_output":"Change in probability ranges caused by source dependence."},{"id":"alternative-causal-sequence","variable":"Order of organic mobilisation and state response.","low_assumption":"Organic mobilisation clearly precedes state action.","high_assumption":"State preparation clearly precedes mobilisation.","reported_output":"Effect on organic, deliberate and mixed-cause hypotheses."}]},"scoring_contract":{"brier_score":true,"logarithmic_score":true,"calibration_bucket_boundaries":[0.0,0.1,0.3,0.5,0.7,0.9,1.0],"resolution_standard":"Score only against an independently documented outcome definition established before resolution review.","unresolved_outcome_policy":"Retain as unresolved and exclude from accuracy scoring while preserving the forecast and revision history.","reporting_cadence":"Publish calibration and discrimination summaries after at least 20 resolved forecasts and thereafter at fixed review intervals."},"forecast_ledger":[{"revision":1,"recorded_at":"2026-08-02T11:35:00+00:00","reason":"Initial controlled probability-contract fixture.","assessment_state_sha256":"08b9a40f4a19df0bdc90d19653d11b4c14e3da3ffd2aa8e307b000025a75b38c","probabilities_changed":false,"previous_revision_sha256":null,"revision_sha256":"1d17a0de73b03411ea6d3747764a0c692ee973442e8e7dc6aa5c1667c052bb97"},{"revision":2,"recorded_at":"2026-08-02T11:36:00+00:00","reason":"Added sensitivity, scoring and explicit safety controls without changing probabilities.","assessment_state_sha256":"3ee04497dca2dc0f4d266e3c932f75e933b8fda1f55f9df73c5df07af55d096d","probabilities_changed":false,"previous_revision_sha256":"1d17a0de73b03411ea6d3747764a0c692ee973442e8e7dc6aa5c1667c052bb97","revision_sha256":"e1c1e23c42e20be4aa32c279a52805f541bb975a746cd01a1e6798f3ddc84c97"}],"update_triggers":[{"id":"authenticated-command-record","description":"An authenticated operational instruction or communication becomes available.","expected_effect":"May materially change deliberate domestic or foreign-command hypotheses.","required_action":"Create a new immutable revision, reassess source dependence and rerun sensitivity tests."},{"id":"independent-mobilisation-origin","description":"Independent evid